[
  {
    "id": "r-large-3",
    "stars": 1,
    "text": "Messages stuck sending since the update",
    "thumbs_up": 412,
    "app_version": "2.26.21.7",
    "created_at": "2026-10-28T08:15:00+00:00"
  },
  {
    "id": "r-large-2",
    "stars": 5,
    "text": "Works great",
    "thumbs_up": 3,
    "app_version": null,
    "created_at": "2026-10-28T07:00:00+00:00"
  },
  {
    "id": "r-large-1",
    "stars": 3,
    "text": "",
    "thumbs_up": 0,
    "app_version": "2.26.20.1",
    "created_at": "2026-10-27T23:59:59+00:00"
  }
]
